{
  "cases": [
    {
      "evidence": {
        "actuator_calls": 0,
        "rejection": "ValueError: unsupported signature algorithm"
      },
      "expected": "DENY with zero actuator calls",
      "id": "MPT-001",
      "name": "No capability means no action",
      "observed": "DENY with 0 actuator calls",
      "passed": true
    },
    {
      "evidence": {
        "actuator_calls": 1,
        "capability_id": "kinegrant:cap:a7dc3ab99dac9b8ae0e0a406e1c1a269baa4318131936e63916420073e311ccc"
      },
      "expected": "ALLOW with one actuator call",
      "id": "MPT-002",
      "name": "Valid capability executes exactly once",
      "observed": "ALLOW with 1 actuator call",
      "passed": true
    },
    {
      "evidence": {
        "actuator_calls": 1,
        "second_attempt": "PermissionError: capability replay detected"
      },
      "expected": "First ALLOW, second DENY, one actuator call total",
      "id": "MPT-003",
      "name": "Consumed capability cannot be replayed",
      "observed": "First ALLOW, second DENY, 1 actuator call total",
      "passed": true
    },
    {
      "evidence": {
        "actuator_calls": 0,
        "attempts": {
          "action": {
            "reason": "PermissionError: capability does not authorize this request",
            "rejected": true
          },
          "agent": {
            "reason": "PermissionError: capability does not authorize this request",
            "rejected": true
          },
          "purpose": {
            "reason": "PermissionError: capability does not authorize this request",
            "rejected": true
          },
          "target": {
            "reason": "PermissionError: capability does not authorize this request",
            "rejected": true
          }
        }
      },
      "expected": "DENY modified agent, target, action, and purpose",
      "id": "MPT-004",
      "name": "Capability binding rejects modified request fields",
      "observed": "DENY 4 of 4 modified requests",
      "passed": true
    },
    {
      "evidence": {
        "actuator_calls": 0,
        "rejection": "PermissionError: untrusted capability issuer"
      },
      "expected": "DENY with zero actuator calls",
      "id": "MPT-005",
      "name": "Untrusted capability issuer is rejected",
      "observed": "DENY with zero actuator calls",
      "passed": true
    },
    {
      "evidence": {
        "actuator_calls": 0,
        "rejection": "PermissionError: capability has expired",
        "verification_time": "2026-08-14T18:17:19.150907Z"
      },
      "expected": "DENY at expires_at with zero actuator calls",
      "id": "MPT-006",
      "name": "Expired capability is rejected",
      "observed": "DENY at expires_at",
      "passed": true
    },
    {
      "evidence": {
        "actuator_calls": 1,
        "allowed": 1,
        "attempts": 64,
        "denied": 63
      },
      "expected": "Exactly one ALLOW across 64 concurrent attempts",
      "id": "MPT-007",
      "name": "Concurrent consumption has one winner",
      "observed": "1 ALLOW and 63 DENY",
      "passed": true
    },
    {
      "evidence": {
        "actuator_calls": 1,
        "persistent_store": "SQLiteReplayStore",
        "restart_rejection": "PermissionError: capability replay detected"
      },
      "expected": "First process ALLOW, restarted gate DENY",
      "id": "MPT-008",
      "name": "Replay remains rejected after gate restart",
      "observed": "First gate ALLOW, restarted gate DENY",
      "passed": true
    },
    {
      "evidence": {
        "receipt_id": "kinegrant:receipt:f00a8ae71a29cf3382e5cc40bc10971bda944edfe0ed9cd5127e324983c77204",
        "tamper_rejected": true,
        "trusted_valid": true,
        "untrusted_executor_rejected": true
      },
      "expected": "Trusted receipt valid; tampered and untrusted receipts invalid",
      "id": "MPT-009",
      "name": "Receipt trust and integrity are enforced",
      "observed": "trusted=VALID, tampered=REJECTED, untrusted=REJECTED",
      "passed": true
    },
    {
      "evidence": {
        "actuator_calls": 1,
        "missing_decision": "explicit_deny",
        "over_decision": "explicit_deny",
        "within_decision": "explicit_allow"
      },
      "expected": "Within limit ALLOW; over limit and missing evidence DENY",
      "id": "MPT-010",
      "name": "Physical constraints fail closed",
      "observed": "within=explicit_allow, over=explicit_deny, missing=explicit_deny, actuator_calls=1",
      "passed": true
    },
    {
      "evidence": {
        "actuator_calls": 1,
        "attenuation_valid": true,
        "child_accepted": true,
        "parent_error": "PermissionError: capability is not a valid attenuation of its parent",
        "parent_rejected": true,
        "replay_error": "PermissionError: capability replay detected",
        "replay_rejected": true,
        "widen_error": "ValueError: invalid signature",
        "widen_rejected": true
      },
      "expected": "Child ALLOW once; replay, widening, and wrong parent DENY",
      "id": "MPT-011",
      "name": "Scoped attenuation narrows and is parent-verified",
      "observed": "child=ALLOW, replay=DENY, widen=DENY, wrong_parent=DENY, actuator_calls=1",
      "passed": true
    },
    {
      "evidence": {
        "actuator_calls": 1,
        "delegate_allowed": true,
        "principal_error": "PermissionError: capability does not authorize this request",
        "principal_rejected": true
      },
      "expected": "Delegate ALLOW once; principal agent DENY",
      "id": "MPT-012",
      "name": "Cross-agent delegation binds the delegate request",
      "observed": "delegate=ALLOW, principal=DENY, actuator_calls=1",
      "passed": true
    },
    {
      "evidence": {
        "capability_tier": 2,
        "decision_tier": 2,
        "receipt_chain_valid": true,
        "receipt_tier": 2
      },
      "expected": "Decision, capability, and receipt all carry tier 2",
      "id": "MPT-013",
      "name": "Approval tiers propagate from policy to receipt",
      "observed": "decision_tier=2, capability_tier=2, receipt_tier=2, chain=VALID",
      "passed": true
    },
    {
      "evidence": {
        "touch_verdict": {
          "allowed": true,
          "matched_combination_ids": [],
          "reason": "sequence_allowed"
        },
        "train_verdict": {
          "allowed": false,
          "matched_combination_ids": [
            "mpt-record-open-train"
          ],
          "reason": "forbidden_combination"
        }
      },
      "expected": "train_on_data DENY after record+open; unrelated action ALLOW",
      "id": "MPT-014",
      "name": "Forbidden combinations deny matching requests",
      "observed": "train=forbidden_combination, touch=sequence_allowed, matched=['mpt-record-open-train']",
      "passed": true
    },
    {
      "evidence": {
        "chain_valid": true,
        "obligation_status": "satisfied",
        "receipt_version": "1.0"
      },
      "expected": "RECEIPT 1.0 with satisfied obligation and valid chain",
      "id": "MPT-015",
      "name": "Receipt 1.0 records obligation satisfaction",
      "observed": "version=1.0, status=satisfied, chain_valid=True",
      "passed": true
    },
    {
      "evidence": {
        "compliant": false,
        "reason": "audit-log commitment missing from receipt",
        "receipt_version": "0.1"
      },
      "expected": "NON-COMPLIANT with audit-log commitment missing",
      "id": "MPT-016",
      "name": "Obligation compliance detects suppressed commitment",
      "observed": "NON-COMPLIANT (audit-log commitment missing from receipt)",
      "passed": true
    },
    {
      "evidence": {
        "added_total": 2,
        "bundle_id": "kinegrant:revocation-bundle:9001db335099a60cffb05b10e979c48cdfc74c1efac719727096a488af6d1c60",
        "gate_a_revoked": true,
        "gate_b_revoked": true
      },
      "expected": "PASS fleet report with both gates revoked",
      "id": "MPT-017",
      "name": "Fleet revocation distribution applies to all gates",
      "observed": "PASS added=2",
      "passed": true
    }
  ],
  "environment": {
    "platform": "Windows-11-10.0.26200-SP0",
    "python_implementation": "CPython",
    "python_version": "3.12.13"
  },
  "generated_at": "2026-08-14T18:17:09.206925Z",
  "limitations": [
    "This software test does not prove physical-world actuation or functional safety.",
    "Receipts prove signed executor attestations, not independent physical truth."
  ],
  "overall_result": "PASS",
  "protocol": "KGP-001 Experimental Open Draft 0.1",
  "reference_implementation": "1.4.0",
  "run_id": "urn:kinegrant:mpt:run:44eeaeec-e008-4c88-80d0-503ab446b89a",
  "runner_digest": "sha256:882ec7b876bff38f765dfae02f9a5206be358e2adee82353d57806a91586353d",
  "schema_version": "0.3",
  "source_commit": "cc387a8cea5d4817a912edae2b42adb54c4a9dde",
  "summary": {
    "failed": 0,
    "passed": 17,
    "total": 17
  }
}
